{
    "$schema": "http://json-schema.org/draft-04/schema#",
    "type": "object",
    "properties": {
        "id": {
            "type": "integer"
        },
        "name": {
            "type": "string"
        },
        "price": {
            "type": "string"
        },
        "amount": {
            "type": "string"
        },
        "units": {
            "type": "string"
        },
        "store": {
            "type": "string"
        }
    },
    "required": [
        "id",
        "name",
        "price",
        "amount",
        "units",
        "store"
    ]
}
